{
  "revisionId": "generic-portrait-square@1",
  "id": "generic-portrait-square",
  "version": 1,
  "schemaVersion": 1,
  "label": {
    "en": "Generic portrait (1200x1200 square)"
  },
  "jurisdiction": "generic",
  "documentType": "portrait",
  "submissionChannel": "digital_upload",
  "applicantClass": "all",
  "sources": [
    {
      "id": "pb-spec-5-2",
      "url": "https://github.com/portrait-booth/spec",
      "title": "Portrait Booth SPEC §5.2 first template candidates",
      "authority": "Portrait Booth project-internal specification",
      "accessedAt": "2026-08-05"
    }
  ],
  "output": {
    "kind": "exact_pixels",
    "widthPx": 1200,
    "heightPx": 1200,
    "aspect": {
      "width": 1,
      "height": 1,
      "enforcement": "mandatory",
      "provenance": "derived"
    }
  },
  "outputFile": {
    "mime": ["image/jpeg"],
    "colorSpace": "sRGB",
    "bitsPerChannel": 8,
    "channels": 3
  },
  "cropRules": [],
  "captureRules": [],
  "overlay": { "kind": "none", "ruleIds": [] },
  "capabilities": {
    "selfCapture": "allowed",
    "crop": "allowed",
    "rotate": "allowed",
    "mirror": "allowed",
    "retouch": "allowed",
    "backgroundReplace": "allowed",
    "requiresOriginalCameraFile": false,
    "requiresProfessionalPhotographer": false
  },
  "sourceNotes": {
    "en": [
      "Unofficial document template: this template is not a government agency's document photo specification and must not be used for official applications.",
      "Mirroring, free composition, and basic editing are allowed; output is for generic portraits or development acceptance only."
    ]
  }
}
